{
  "id": "autonomous-research-agent",
  "name": "Autonomous Research Agent",
  "type": "ultimate",
  "level": "5★",
  "rarity": "legendary",
  "description": "Independently conducts end-to-end research cycles including hypothesis generation, evidence gathering, synthesis, and reporting.",
  "prerequisites": [
    "research",
    "knowledge-harvest",
    "ghostwrite"
  ],
  "derivatives": [],
  "conditions": "Requires extensive multi-system validation before level advancement.",
  "evidence": [
    {
      "class": "B",
      "source": "https://github.com/balukosuri/Andrej-Karpathy-s-Autoresearch-As-a-Universal-Skill",
      "evaluator": "mbtiongson1",
      "date": "2026-04-30",
      "notes": "Community reproduction of Karpathy's autoresearch pattern as a universal agent skill, demonstrating generalizability beyond the original repo."
    }
  ],
  "knownAgents": [],
  "status": "provisional",
  "createdAt": "2026-04-26",
  "updatedAt": "2026-04-30",
  "version": "0.1.0",
  "title": "Wisdom King"
}
