{
  "id": "receiving-code-review",
  "name": "Receiving Code Review",
  "type": "basic",
  "level": "2★",
  "rarity": "common",
  "description": "Processes code review feedback with technical rigor and verification before implementation, questioning unclear feedback.",
  "prerequisites": [],
  "derivatives": [
    "superpowers"
  ],
  "conditions": "",
  "evidence": [
    {
      "class": "B",
      "source": "https://github.com/obra/superpowers/blob/main/skills/receiving-code-review/SKILL.md",
      "evaluator": "mbtiongson1",
      "date": "2026-05-18",
      "notes": "obra/superpowers — complete software development methodology for coding agents, 196k+ stars, v5.1.0, adopted across Claude Code, Codex CLI, Gemini CLI, OpenCode, Cursor, GitHub Copilot CLI."
    }
  ],
  "knownAgents": [],
  "status": "provisional",
  "createdAt": "2026-05-18",
  "updatedAt": "2026-05-18",
  "version": "0.1.0"
}