{
  "id": "mattpocock-productivity",
  "name": "mattpocock-productivity",
  "type": "extra",
  "level": "4★",
  "rarity": "common",
  "description": "Productivity category suite for Matt Pocock's skills.",
  "prerequisites": [
    "agent-handoff",
    "context-compression",
    "grill-me",
    "tool-creation"
  ],
  "derivatives": [],
  "evidence": [
    {
      "class": "B",
      "source": "https://github.com/mattpocock/skills",
      "evaluator": "mbtiongson1",
      "date": "2026-05-22",
      "notes": "Consolidated productivity suite for Matt Pocock's skills."
    }
  ],
  "knownAgents": [],
  "status": "provisional",
  "createdAt": "2026-05-22",
  "updatedAt": "2026-05-22",
  "version": "0.1.0",
  "timeline": [
    {
      "timestamp": "2026-05-21T16:24:53Z",
      "action": "add",
      "contributor": "mbtiongson1",
      "details": "Added generic skill mattpocock-productivity"
    },
    {
      "timestamp": "2026-05-21T16:31:25Z",
      "action": "propose",
      "contributor": "mbtiongson1",
      "details": "Skill created as 1★ (provisional)",
      "previousValue": null,
      "newValue": "1★"
    },
    {
      "timestamp": "2026-05-21T17:17:21Z",
      "action": "evidence_added",
      "contributor": "mbtiongson1",
      "details": "Added B evidence from https://github.com/mattpocock/skills"
    },
    {
      "timestamp": "2026-05-21T17:19:20Z",
      "action": "demote",
      "contributor": "mbtiongson1",
      "details": "Calibrated/demoted rank from 1★ to 4★",
      "previousValue": "1★",
      "newValue": "4★"
    },
    {
      "timestamp": "2026-05-21T17:19:20Z",
      "action": "evidence_added",
      "contributor": "mbtiongson1",
      "details": "Added evidence: https://github.com/mattpocock/skills",
      "previousValue": null,
      "newValue": "4★"
    },
    {
      "timestamp": "2026-05-21T19:04:11Z",
      "action": "type_change",
      "contributor": "mbtiongson1",
      "details": "Reclassified from ultimate to extra"
    }
  ]
}
