{
  "id": "executing-plans",
  "name": "Executing Plans",
  "type": "extra",
  "level": "2★",
  "rarity": "common",
  "description": "Loads a written implementation plan, reviews it critically, executes all tasks sequentially, and reports when complete.",
  "prerequisites": [
    "writing-plans",
    "tool-use"
  ],
  "derivatives": [
    "superpowers",
    "subagent-driven-development"
  ],
  "conditions": "",
  "evidence": [
    {
      "class": "B",
      "source": "https://github.com/obra/superpowers/blob/main/skills/executing-plans/SKILL.md",
      "evaluator": "mbtiongson1",
      "date": "2026-05-18",
      "notes": "obra/superpowers — complete software development methodology for coding agents, 196k+ stars, v5.1.0, adopted across Claude Code, Codex CLI, Gemini CLI, OpenCode, Cursor, GitHub Copilot CLI."
    }
  ],
  "knownAgents": [],
  "status": "provisional",
  "createdAt": "2026-05-18",
  "updatedAt": "2026-05-19",
  "version": "0.1.0",
  "timeline": [
    {
      "timestamp": "2026-05-18T14:11:08Z",
      "action": "propose",
      "contributor": "mbtiongson1",
      "details": "Skill created as 2★ (provisional)",
      "previousValue": null,
      "newValue": "2★"
    },
    {
      "timestamp": "2026-05-19T13:55:59Z",
      "action": "type_change",
      "contributor": "mbtiongson1",
      "details": "Type adjusted from basic to extra",
      "previousValue": "basic",
      "newValue": "extra"
    }
  ]
}
