{
  "id": "github-platform-mastery",
  "name": "GitHub Platform Mastery",
  "type": "extra",
  "level": "3★",
  "rarity": "uncommon",
  "description": "Full GitHub platform automation: code review pipelines, multi-repo coordination, project management, release management, and workflow automation.",
  "prerequisites": [
    "code-review-pipeline",
    "multi-repo-coordination",
    "deployment-automation",
    "project-management",
    "workflow-automation"
  ],
  "derivatives": [],
  "conditions": "",
  "evidence": [
    {
      "class": "B",
      "source": "https://github.com/ruvnet/ruflo",
      "evaluator": "mbtiongson1",
      "date": "2026-05-19",
      "notes": "Ruflo orchestration platform — 34k+ GitHub stars."
    }
  ],
  "knownAgents": [],
  "status": "provisional",
  "createdAt": "2026-05-19",
  "updatedAt": "2026-05-19",
  "version": "0.1.0",
  "timeline": [
    {
      "timestamp": "2026-05-19T16:29:16Z",
      "action": "propose",
      "contributor": "claude",
      "details": "Skill created as 4★ (provisional)",
      "previousValue": null,
      "newValue": "4★"
    },
    {
      "timestamp": "2026-05-19T22:44:52Z",
      "action": "demote",
      "contributor": "mbtiongson1",
      "details": "Calibrated/demoted rank from 4★ to 3★",
      "previousValue": "4★",
      "newValue": "3★"
    }
  ]
}
