{
  "id": "multi-agent-orchestration-v",
  "name": "Multi-Agent Orchestration",
  "type": "ultimate",
  "level": "5★",
  "rarity": "legendary",
  "description": "Coordinates multiple specialized agents across complex workflows with dynamic task allocation and conflict resolution.",
  "prerequisites": [
    "plan-and-execute",
    "route-intent",
    "tool-select"
  ],
  "derivatives": [],
  "conditions": "Requires extensive multi-system validation before level advancement.",
  "evidence": [
    {
      "class": "B",
      "source": "https://github.com/ruvnet/ruflo",
      "evaluator": "mbtiongson1",
      "date": "2026-05-17",
      "notes": "Replaced missing seed evidence with live repository from real-skills catalog."
    }
  ],
  "knownAgents": [],
  "status": "provisional",
  "createdAt": "2026-04-26",
  "updatedAt": "2026-04-26",
  "version": "0.1.0",
  "title": "Grand Conductor"
}
