{
  "id": "recursive-self-improvement",
  "name": "Recursive Self-Improvement",
  "type": "ultimate",
  "level": "1★",
  "rarity": "legendary",
  "description": "Agent iteratively refines its own prompts, tools, or strategies based on performance feedback loops.",
  "prerequisites": [
    "autonomous-debug",
    "evaluate-output",
    "plan-and-execute"
  ],
  "derivatives": [],
  "conditions": "Requires extensive multi-system validation before level advancement.",
  "evidence": [],
  "knownAgents": [],
  "status": "provisional",
  "createdAt": "2026-04-26",
  "updatedAt": "2026-04-26",
  "version": "0.1.0",
  "title": "Unbound Sage"
}
