{
  "id": "few-shot-learning",
  "name": "Few-Shot Learning",
  "type": "basic",
  "level": "2★",
  "rarity": "common",
  "description": "Conditions a language model on a small number of input-output demonstrations within the prompt, enabling task adaptation without weight updates.",
  "prerequisites": [],
  "derivatives": [
    "chain-of-thought",
    "conversational-agent"
  ],
  "conditions": "",
  "evidence": [
    {
      "class": "A",
      "source": "https://arxiv.org/abs/2005.14165",
      "evaluator": "mbtiongson1",
      "date": "2026-04-29",
      "notes": "Brown et al. (2020) â€” Language Models are Few-Shot Learners (GPT-3); in-context learning from 1-100 examples achieves near-SOTA on SuperGLUE, translation, and QA benchmarks."
    }
  ],
  "knownAgents": [],
  "status": "provisional",
  "createdAt": "2026-04-29",
  "updatedAt": "2026-05-25",
  "version": "0.2.0",
  "timeline": [
    {
      "timestamp": "2026-05-13T21:50:25Z",
      "action": "propose",
      "contributor": "mbtiongson1",
      "details": "Skill created as 4★ (provisional)",
      "previousValue": null,
      "newValue": "4★"
    },
    {
      "timestamp": "2026-05-14T20:30:46Z",
      "action": "type_change",
      "contributor": "mbtiongson1",
      "details": "Type adjusted from basic to unique",
      "previousValue": "basic",
      "newValue": "unique"
    },
    {
      "timestamp": "2026-05-25T03:44:41Z",
      "action": "type_change",
      "contributor": "mbtiongson1",
      "details": "Reclassified from unique to basic"
    },
    {
      "timestamp": "2026-05-25T03:45:22Z",
      "action": "type_change",
      "contributor": "mbtiongson1",
      "details": "Type adjusted from unique to basic",
      "previousValue": "unique",
      "newValue": "basic"
    },
    {
      "timestamp": "2026-05-25T03:45:37Z",
      "action": "demote",
      "contributor": "mbtiongson1",
      "details": "Calibrated level from 4★ to 2★"
    },
    {
      "timestamp": "2026-05-25T03:46:10Z",
      "action": "demote",
      "contributor": "mbtiongson1",
      "details": "Calibrated/demoted rank from 4★ to 2★",
      "previousValue": "4★",
      "newValue": "2★"
    }
  ]
}
