{
  "id": "gstack",
  "name": "Founder Mode",
  "type": "ultimate",
  "level": "5\u2605",
  "rarity": "legendary",
  "description": "Garry Tan's complete autonomous agent discipline suite spanning 46 named skills: browser QA, security auditing, design system creation, HTML generation, plan reviews (CEO/eng/design/DX), code review, root-cause debugging, E2E testing, ship/deploy automation, post-deploy canary monitoring, documentation, and founder-mode orchestration.",
  "prerequisites": [
    "question-answer",
    "evaluate-output",
    "code-review-pipeline",
    "ux-audit",
    "vertical-slice-planning",
    "design-system-extraction",
    "design-review",
    "code-generation",
    "systematic-debugging",
    "e2e-testing",
    "finishing-a-development-branch",
    "deployment-automation",
    "detect-anomaly",
    "document-editing",
    "browser-automation",
    "security-audit",
    "browser-control",
    "web-scrape",
    "skill-authoring",
    "write-report",
    "multi-agent-debate",
    "skill-performance-benchmarking",
    "automated-testing",
    "mcp-integration",
    "memory-manage",
    "guardrails",
    "knowledge-management",
    "format-output",
    "workspace-automation",
    "project-management",
    "prompt-optimization"
  ],
  "derivatives": [],
  "conditions": "Requires demonstrating all 31 garrytan discipline skills together in a real multi-step context.",
  "evidence": [
    {
      "class": "A",
      "source": "https://github.com/garrytan/gstack",
      "evaluator": "mbtiongson1",
      "date": "2026-05-18",
      "notes": "garrytan/gstack \u2014 46 named garrytan skills registered in Gaia across 16 generic skill buckets; meets the >=5 named-skills threshold for Class A designation. Additionally: 98.9k GitHub stars, multi-platform adoption across 8+ runtimes (Claude Code, OpenAI Codex CLI, OpenCode, Cursor, Factory Droid, Slate, Kiro, Hermes)."
    }
  ],
  "knownAgents": [],
  "status": "provisional",
  "createdAt": "2026-05-18",
  "updatedAt": "2026-05-18",
  "version": "0.1.0",
  "timeline": [
    {
      "timestamp": "2026-05-18T00:00:00Z",
      "action": "fuse",
      "contributor": "mbtiongson1",
      "details": "Fused 5 garrytan/gstack skills into /gstacks ultimate. Components: security-audit, design-review, vertical-slice-planning, browser-automation, question-answer. Promoted to 5\u2605 on evidence: garrytan/gstack 98.9k stars, 8+ platform adoption (Claude Code, Codex CLI, OpenCode, Cursor, Factory Droid, Slate, Kiro, Hermes)."
    },
    {
      "timestamp": "2026-05-18T12:00:00Z",
      "action": "rank_up",
      "contributor": "mbtiongson1",
      "details": "Expanded prerequisites from 5 to 16 to cover the full garrytan/gstack suite. Added 41 new named skills: plan-ceo-review, plan-eng-review, plan-design-review, plan-devex-review, review, investigate, qa, ship, land-and-deploy, canary, document-generate, design-html, design-consultation, benchmark. Upgraded evidence from Class B to Class A (>=5 named-skills criterion met: 19 named skills). Total named garrytan skills: 46."
    },
    {
      "timestamp": "2026-05-18T00:00:00Z",
      "action": "rank_up",
      "contributor": "mbtiongson1",
      "details": "Expanded gstack prerequisites from 25 \u2192 31 via prerequisite graph analysis. Added to gstack: guardrails, knowledge-management, format-output, workspace-automation, project-management, prompt-optimization. Promoted 3 basic nodes to extra tier to carry workflow chain prerequisites: finishing-a-development-branch (prereqs: code-review-pipeline, diff-content), detect-anomaly (prereqs: evaluate-output, error-interpretation), memory-manage (prereqs: context-compression, retrieve)."
    }
  ]
}