{
  "id": "image-generate",
  "name": "Image Generate",
  "type": "basic",
  "level": "2★",
  "rarity": "uncommon",
  "description": "Creates photorealistic or stylized images from text prompts using diffusion-based or autoregressive generative models.",
  "prerequisites": [],
  "derivatives": [],
  "conditions": "",
  "evidence": [
    {
      "class": "A",
      "source": "https://arxiv.org/abs/2112.10752",
      "evaluator": "mbtiongson1",
      "date": "2026-04-28",
      "notes": "Latent Diffusion Models (Rombach et al.) â€” foundational paper for Stable Diffusion; achieves FID 5.11 on LSUN-Beds at 200Ã— less compute than pixel-space diffusion."
    }
  ],
  "knownAgents": [],
  "status": "provisional",
  "createdAt": "2026-04-28",
  "updatedAt": "2026-04-28",
  "version": "0.2.0",
  "timeline": [
    {
      "timestamp": "2026-05-13T21:50:25Z",
      "action": "propose",
      "contributor": "mbtiongson1",
      "details": "Skill created as 2★ (provisional)",
      "previousValue": null,
      "newValue": "2★"
    }
  ]
}
