{
  "id": "computer-use",
  "name": "Computer Use",
  "type": "basic",
  "level": "2★",
  "rarity": "rare",
  "description": "Controls desktop GUIs and web browsers by interpreting screenshots, issuing mouse/keyboard actions, and verifying visual state to complete open-ended computer tasks.",
  "prerequisites": [],
  "derivatives": [
    "browser-automation"
  ],
  "conditions": "Requires screenshot observation loop and action executor (click, type, scroll).",
  "evidence": [
    {
      "class": "A",
      "source": "https://arxiv.org/abs/2307.13854",
      "evaluator": "mbtiongson1",
      "date": "2026-04-28",
      "notes": "WebArena (Zhou et al., 2023) â€” realistic 812-task benchmark for autonomous web agents; establishes controlled eval for GUI-based computer use."
    },
    {
      "class": "B",
      "source": "https://github.com/xlang-ai/OSWorld",
      "evaluator": "mbtiongson1",
      "date": "2026-04-28",
      "notes": "OSWorld â€” 369 computer tasks across real OS environments (Windows, macOS, Ubuntu); reproducible VM-based evaluation harness."
    }
  ],
  "knownAgents": [],
  "status": "provisional",
  "createdAt": "2026-04-28",
  "updatedAt": "2026-04-28",
  "version": "0.2.0",
  "timeline": [
    {
      "timestamp": "2026-05-13T21:50:25Z",
      "action": "propose",
      "contributor": "mbtiongson1",
      "details": "Skill created as 2★ (provisional)",
      "previousValue": null,
      "newValue": "2★"
    }
  ]
}
