{
  "id": "data-analysis",
  "name": "Data Analysis",
  "type": "extra",
  "level": "3★",
  "rarity": "uncommon",
  "description": "Conducts end-to-end quantitative analysis: queries data via SQL, computes statistics, generates visualizations, and summarizes findings.",
  "prerequisites": [
    "generate-sql",
    "data-visualize",
    "summarize"
  ],
  "derivatives": [
    "autonomous-data-scientist",
    "ml-pipeline",
    "prediction-market-analysis"
  ],
  "conditions": "",
  "evidence": [
    {
      "class": "B",
      "source": "https://github.com/Sinaptik-AI/pandas-ai",
      "evaluator": "mbtiongson1",
      "date": "2026-04-28",
      "notes": "pandas-ai â€” open-source agent for natural-language data analysis over pandas DataFrames; reproducible demos with logging and output artifacts."
    }
  ],
  "knownAgents": [],
  "status": "provisional",
  "createdAt": "2026-04-28",
  "updatedAt": "2026-05-06",
  "version": "0.2.0",
  "timeline": [
    {
      "timestamp": "2026-05-13T21:50:25Z",
      "action": "propose",
      "contributor": "mbtiongson1",
      "details": "Skill created as 3★ (provisional)",
      "previousValue": null,
      "newValue": "3★"
    }
  ]
}
