{
  "id": "mattpocock-skills",
  "name": "mattpocock-skills",
  "type": "ultimate",
  "level": "6★",
  "rarity": "common",
  "description": "Ultimate capstone suite for Matt Pocock's skills.",
  "prerequisites": [
    "mattpocock-engineering",
    "mattpocock-productivity",
    "mattpocock-personal",
    "tool-creation",
    "ubiquitous-language"
  ],
  "derivatives": [],
  "evidence": [
    {
      "class": "B",
      "source": "https://github.com/mattpocock/skills",
      "evaluator": "mbtiongson1",
      "date": "2026-05-22",
      "notes": "The ultimate Matt Pocock skill suite capstone."
    },
    {
      "class": "A",
      "source": "https://github.com/mbtiongson1/gaia-skill-tree/pull/352",
      "evaluator": "mbtiongson1",
      "date": "2026-05-22",
      "notes": "Peer-reviewed ultimate capstone suite consolidation."
    },
    {
      "class": "A",
      "source": "https://github.com/mattpocock/skills",
      "evaluator": "mbtiongson1",
      "date": "2026-05-25",
      "notes": "Matt Pocock complete agent discipline library with 100k+ GitHub stars across the ecosystem."
    }
  ],
  "knownAgents": [],
  "status": "provisional",
  "createdAt": "2026-05-22",
  "updatedAt": "2026-05-25",
  "version": "0.1.0",
  "timeline": [
    {
      "timestamp": "2026-05-21T16:25:28Z",
      "action": "add",
      "contributor": "mbtiongson1",
      "details": "Added generic skill mattpocock-skills"
    },
    {
      "timestamp": "2026-05-21T17:18:01Z",
      "action": "evidence_added",
      "contributor": "mbtiongson1",
      "details": "Added B evidence from https://github.com/mattpocock/skills"
    },
    {
      "timestamp": "2026-05-21T17:18:32Z",
      "action": "evidence_added",
      "contributor": "mbtiongson1",
      "details": "Added A evidence from https://github.com/mbtiongson1/gaia-skill-tree/pull/352"
    },
    {
      "timestamp": "2026-05-25T03:46:19Z",
      "action": "demote",
      "contributor": "mbtiongson1",
      "details": "Calibrated level from 6★ to 6★"
    },
    {
      "timestamp": "2026-05-25T03:46:20Z",
      "action": "evidence_added",
      "contributor": "mbtiongson1",
      "details": "Added A evidence from https://github.com/mattpocock/skills"
    }
  ]
}
