{
  "id": "schema-design",
  "name": "Schema Design",
  "type": "basic",
  "level": "2★",
  "rarity": "common",
  "description": "Design database schemas across relational, NoSQL, graph, and time-series stores — entity modelling, normalization, indexing strategies, and migration planning.",
  "prerequisites": [],
  "derivatives": [],
  "conditions": "",
  "evidence": [
    {
      "class": "C",
      "source": "https://github.com/intelligentcode-ai/skills/blob/main/skills/database-engineer/SKILL.md",
      "evaluator": "mbtiongson1",
      "date": "2026-04-30",
      "notes": "intelligentcode-ai/skills database-engineer — schema design and query optimization expert across relational, NoSQL, graph, time-series, and data warehouses."
    }
  ],
  "knownAgents": [],
  "status": "provisional",
  "createdAt": "2026-04-30",
  "updatedAt": "2026-04-30",
  "version": "0.2.0",
  "timeline": [
    {
      "timestamp": "2026-05-13T21:50:25Z",
      "action": "propose",
      "contributor": "mbtiongson1",
      "details": "Skill created as 2★ (provisional)",
      "previousValue": null,
      "newValue": "2★"
    }
  ]
}
